album,song_title,lyrics
Red,Red,"[Verse 1] Loving him is like driving a new Maserati Down a dead-end street Faster than the wind, passionate as sin Ending so suddenly Loving him is like trying to change your mind Once you're already flying through the free fall Like the colors in autumn, so bright Just before they lose it all [Chorus] Losing him was blue like I'd never known Missing him was dark grey, all alone Forgetting him was like Trying to know somebody you never met But loving him was red Loving him was red [Verse 2] Touching him was like realizing all you ever wanted Was right there in front of you Memorizing him was as easy as knowing All the words to your old favorite song Fighting with him was like trying to solve a crossword And realizing there's no right answer Regretting him was like wishing you never found out That love could be that strong [Chorus] Losing him was blue like I'd never known Missing him was dark grey, all alone Forgetting him was like Trying to know somebody you never met But loving him was red Oh, red Burning red [Bridge] Remembering him comes in flashbacks and echoes Tell myself it's time now, gotta let go But moving on from him is impossible When I still see it all in my head In burning red Loving him was red [Chorus] Oh, losing him was blue like I'd never known Missing him was dark grey, all alone Forgetting him was like Trying to know somebody you never met 'Cause loving him was red Yeah, yeah, red We're burning red [Breakdown] And that's why he's spinning 'round in my head Comes back to me, burning red Yeah, yeah [Outro] His love was like driving a new Maserati Down a dead-end street "
reputation,...Ready for It?,"[Verse 1] Knew he was a killer first time that I saw him Wondered how many girls he had loved and left haunted But if he's a ghost, then I can be a phantom Holdin' him for ransom, some Some boys are tryin' too hard, he don't try at all though Younger than my exes, but he act like such a man, so I see nothing better, I keep him forever Like a vendetta-ta [Pre-Chorus] I, I, I see how this is gon' go Touch me and you'll never be alone I-Island breeze and lights down low No one has to know [Chorus] In the middle of the night, in my dreams You should see the things we do, baby In the middle of the night, in my dreams I know I'm gonna be with you, so I take my time Are you ready for it? [Verse 2] Knew I was a robber first time that he saw me Stealing hearts and running off and never sayin' sorry But if I'm a thief, then he can join the heist, and We'll move to an island, and And he can be my jailer, Burton to this Taylor Every love I've known in comparison is a failure I forget their names now, I'm so very tame now Never be the same now, now [Pre-Chorus] I, I, I see how this is gon' go Touch me and you'll never be alone I-Island breeze and lights down low No one has to know (No one has to know) [Chorus] In the middle of the night, in my dreams You should see the things we do, baby In the middle of the night in my dreams I know I'm gonna be with you, so I take my time Are you ready for it? Oh, are you ready for it? [Post-Chorus] Baby, let the games begin Let the games begin Let the games begin Baby, let the games begin Let the games begin Let the games begin [Pre-Chorus] I, I, I see how this is gon' go Touch me and you'll never be alone I-Island breeze and lights down low No one has to know [Chorus] In the middle of the night (Night), in my dreams (My dreams) You should see the things we do (We do), baby (Baby), hmm (Eh) In the middle of the night, in my dreams (My dreams) I know I'm gonna be with you (I know I'm gonna be with you) So I take my time In the middle of the night [Post-Chorus] Baby, let the games begin Let the games begin Let the games begin Are you ready for it? Baby, let the games begin Let the games begin Let the games begin Are you ready for it? "
reputation,Delicate,"[Intro] This ain't for the best My reputation's never been worse, so You must like me for me… We can't make Any promises now, can we, babe? But you can make me a drink [Verse 1] Dive bar on the East Side, where you at? Phone lights up my nightstand in the black Come here, you can meet me in the back Dark jeans and your Nikes, look at you Oh damn, never seen that color blue Just think of the fun things we could do 'Cause I like you [Pre-Chorus] This ain't for the best My reputation's never been worse, so You must like me for me… Yeah, I want you We can't make Any promises now, can we, babe? But you can make me a drink [Chorus] Is it cool that I said all that? Is it chill that you're in my head? 'Cause I know that it's delicate (Delicate) Is it cool that I said all that? Is it too soon to do this yet? 'Cause I know that it's delicate Isn't it? Isn't it? Isn't it? Isn't it? Isn't it? Isn't it? Isn't it? Isn't it... delicate? [Verse 2] Third floor on the West Side, me and you Handsome, you're a mansion with a view Do the girls back home touch you like I do? Long night, with your hands up in my hair Echoes of your footsteps on the stairs Stay here, honey, I don't wanna share 'Cause I like you [Pre-Chorus] This ain't for the best My reputation's never been worse, so You must like me for me… Yeah, I want you... We can't make Any promises now, can we, babe? But you can make me a drink [Chorus] Is it cool that I said all that? Is it chill that you're in my head? 'Cause I know that it's delicate (Delicate) Is it cool that I said all that? Is it too soon to do this yet? 'Cause I know that it's delicate Isn't it? Isn't it? Isn't it? Isn't it? Isn't it? Isn't it? Isn't it? Isn't it delicate? [Bridge] Sometimes I wonder when you sleep Are you ever dreaming of me? Sometimes when I look into your eyes I pretend you're mine, all the damn time 'Cause I like you [Chorus] Is it cool that I said all that? Is it chill that you're in my head? 'Cause I know that it's delicate (Delicate) (Yeah, I want you) Is it cool that I said all that? Is it too soon to do this yet? 'Cause I know that it's delicate (Delicate) 'Cause I like you Is it cool that I said all that? Isn't it? Isn't it? Isn't it? Isn't it? Is it chill that you're in my head? Isn't it? Isn't it? Isn't it? Isn't it? 'Cause I know that it's delicate Isn't it? Isn't it? Isn't it? Isn't it? (Yeah, I want you) Is it cool that I said all that? Isn't it? Isn't it? Isn't it? Isn't it? Is it too soon to do this yet? Isn't it? Isn't it? Isn't it? 'Cause I know that it's delicate Isn't it delicate? "
reputation,Gorgeous,"[Intro] Gorgeous [Verse 1] You should take it as a compliment That I got drunk and made fun of the way you talk You should think about the consequence Of your magnetic field being a little too strong And I got a boyfriend, he's older than us He's in the club doin' I don't know what You're so cool, it makes me hate you so much (I hate you so much) [Pre-Chorus 1] Whisky on ice, Sunset and Vine You've ruined my life by not being mine [Chorus] You're so gorgeous I can't say anything to your face 'Cause look at your face And I'm so furious At you for making me feel this way But what can I say? You're gorgeous [Verse 2] You should take it as a compliment That I'm talking to everyone here but you (But you, but you) And you should think about the consequence Of you touching my hand in a darkened room (Dark room, dark room) If you've got a girlfriend, I'm jealous of her But if you're single that's honestly worse 'Cause you're so gorgeous it actually hurts (Honey, it hurts) [Pre-Chorus 2] Ocean blue eyes looking in mine I feel like I might sink and drown and die [Chorus] You're so gorgeous I can't say anything to your face (To your face) 'Cause look at your face (Look at your face, gorgeous) And I'm so furious At you for making me feel this way (Feel this way) But what can I say? You're gorgeous [Bridge] You make me so happy it turns back to sad There's nothing I hate more than what I can't have And you are so gorgeous it makes me so mad (Mmh) You make me so happy it turns back to sad (Yeah) There's nothing I hate more than what I can't have and Guess I'll just stumble on home to my cats (Yeugh), alone Unless, you wanna come along? (Oh) [Chorus] You're so gorgeous I can't say anything to your face (To your face) 'Cause look at your face (Look at your face) And I'm so furious (I'm so furious) At you for making me feel this way (Feel this way) But what can I say? (I say) You're gorgeous [Outro] You make me so happy it turns back to sad (Yeah) There's nothing I hate more than what I can't have And you are so gorgeous it makes me so mad (Mmh) You're gorgeous You make me so happy it turns back to sad (It turns back to sad) There's nothing I hate more than what I can't have (What I can have) You are so gorgeous it makes me so mad (Mmh) You're gorgeous "
reputation,End Game  (Ft. Ed Sheeran & Future),"[Chorus: Taylor Swift & Future] I wanna be your end game I wanna be your first string I wanna be your A-Team (Whoa, whoa, whoa) I wanna be your end game, end game [Post-Chorus: Taylor Swift & Future] Big reputation, big reputation Ooh, you and me, we got big reputations, ah And you heard about me, ooh I got some big enemies (Yeah) Big reputation, big reputation Ooh, you and me would be a big conversation, ah (Git, git) And I heard about you, ooh (Yeah) You like the bad ones, too [Verse 1: Future] You so dope, don't overdose, I’m so stoked, I need a toast We do the most, I'm in the Ghost like I'm whippin’ a boat I got a reputation, girl that don't precede me (Yeah) I'm one call away whenever you need me (Yeah) I'm in a G5 (Yeah), come to the A-Side (Yeah) I got a bad boy persona, that's what they like (What they like) You love it, I love it too 'cause you my type (You my type) You hold me down and I protect you with my life [Pre-Chorus: Taylor Swift & Future] I don't wanna touch you, I don't wanna be Just another ex-love you don’t wanna see I don’t wanna miss you (I don't wanna miss you) Like the other girls do I don’t wanna hurt you, I just wanna be Drinking on a beach with you all over me I know what they all say (I know what they all say) But I ain't tryna play [Chorus: Taylor Swift] I wanna be your end game (End game) I wanna be your first string (First string) I wanna be your A-Team (A-Team) I wanna be your end game, end game [Verse 2: Ed Sheeran] Knew her when I was young, reconnected when we were little bit older Both sprung, I got issues and chips on both of my shoulders Reputation precedes me, in rumors, I'm knee-deep The truth is, it's easier to ignore it, believe me Even when we’d argue, we'd not do it for long And you understand the good and bad end up in the song For all your beautiful traits, and the way you do it with ease For all my flaws, paranoia, and insecurities I've made mistakes and made some choices, that's hard to deny After the storm, something was born on the 4th of July I've passed days without fun, this end game is the one With four words on the tip of my tongue, I'll never say it [Pre-Chorus: Taylor Swift] I don't wanna touch you, I don't wanna be Just another ex-love you don't wanna see I don't wanna miss you (I don't wanna miss you) Like the other girls do I don't wanna hurt you, I just wanna be Drinking on a beach with you all over me I know what they all say, yeah But I ain't tryna play [Chorus: Taylor Swift] I wanna be your end game (End game) I wanna be your first string (Wanna be your first string) I wanna be your A-Team (A-Team) I wanna be your end game, end game [Post-Chorus: Taylor Swift & Future] Big reputation, big reputation Ooh, you and me, we got big reputations, ah And you heard about me, ooh I got some big enemies Hey, big reputation, big reputation Ooh, you and me would be a big conversation, ah And I heard about you, ooh You like the bad ones, too [Verse 3: Taylor Swift] I hit you like bang, we tried to forget it, but we just couldn't And I bury hatchets, but I keep maps of where I put 'em Reputation precedes me, they told you I'm crazy I swear I don't love the drama, it loves me And I can't let you go, your hand prints on my soul It's like your eyes are liquor, it's like your body is gold You've been calling my bluff on all my usual tricks So here's the truth from my red lips [Chorus: Taylor Swift, Future, & Ed Sheeran] I wanna be your end game (End game) I wanna be your first string (Me and you, first string) I wanna be your A-Team (Be your A-Team now, A-Team) I wanna be your end game, end game I wanna be your end game (Oh, I do) I wanna be your first string (First string) I wanna be your A-Team (A-Team) I wanna be your end game, end game "
reputation,Look What You Made Me Do,"[Verse 1] I don't like your little games Don't like your tilted stage The role you made me play Of the fool, no, I don't like you I don't like your perfect crime How you laugh when you lie You said the gun was mine Isn't cool, no, I don't like you (Oh) [Pre-Chorus] But I got smarter, I got harder in the nick of time Honey, I rose up from the dead, I do it all the time I've got a list of names and yours is in red, underlined I check it once, then I check it twice, oh! [Chorus] Ooh, look what you made me do Look what you made me do Look what you just made me do Look what you just made me— Ooh, look what you made me do Look what you made me do Look what you just made me do Look what you just made me do [Verse 2] I don't like your kingdom keys They once belonged to me You asked me for a place to sleep Locked me out and threw a feast (What?) The world moves on, another day, another drama, drama But not for me, not for me, all I think about is karma And then the world moves on, but one thing's for sure Maybe I got mine, but you'll all get yours [Pre-Chorus] But I got smarter, I got harder in the nick of time Honey, I rose up from the dead, I do it all the time I've got a list of names and yours is in red, underlined I check it once, then I check it twice, oh! [Chorus] Ooh, look what you made me do Look what you made me do Look what you just made me do Look what you just made me— Ooh, look what you made me do Look what you made me do Look what you just made me do Look what you just made me do [Bridge] I don't trust nobody and nobody trusts me I'll be the actress starring in your bad dreams I don't trust nobody and nobody trusts me I'll be the actress starring in your bad dreams I don't trust nobody and nobody trusts me I'll be the actress starring in your bad dreams I don't trust nobody and nobody trusts me I'll be the actress starring in your bad dreams (Ooh, look what you made me do Look what you made me do Look what you just made me do Look what you just made me— Ooh, look what you made me do Look what you made me do Look what you just made me—) I'm sorry, the old Taylor can't come to the phone right now Why? Oh, 'cause she's dead!"" (Oh) [Chorus] Ooh, look what you made me do Look what you made me do Look what you just made me do Look what you just made me— Ooh, look what you made me do Look what you made me do Look what you just made me do Look what you just made me do Ooh, look what you made me do Look what you made me do Look what you just made me do Look what you just made me— Ooh, look what you made me do Look what you made me do Look what you just made me do Look what you just made me do "
Speak Now (Deluxe),Back to December,"[Verse 1] I'm so glad you made time to see me How's life? Tell me, how's your family? I haven't seen them in a while You've been good, busier than ever We small talk, work and the weather Your guard is up and I know why [Pre-Chorus] Because the last time you saw me Is still burned in the back of your mind You gave me roses, and I left them there to die [Chorus] So this is me swallowing my pride Standing in front of you, saying I'm sorry for that night And I'd go back to December all the time It turns out freedom ain't nothing but missing you Wishing I'd realized what I had when you were mine [Post-Chorus] I'd go back to December, turn around and make it alright I go back to December all the time [Verse 2] These days, I haven't been sleeping Staying up, playing back myself leaving When your birthday passed and I didn't call And I think about summer, all the beautiful times I watched you laughing from the passenger side and Realized I loved you in the fall [Pre-Chorus] And then the cold came The dark days when fear crept into my mind You gave me all your love, and all I gave you was goodbye [Chorus] So this is me swallowing my pride Standing in front of you, saying I'm sorry for that night And I'd go back to December all the time It turns out freedom ain't nothing but missing you Wishing I'd realized what I had when you were mine [Post-Chorus] I'd go back to December, turn around and change my own mind I go back to December all the time [Bridge] I miss your tan skin, your sweet smile So good to me, so right And how you held me in your arms that September night The first time you ever saw me cry Maybe this is wishful thinking Probably mindless dreaming But if we loved again, I swear I'd love you right I'd go back in time and change it, but I can't So if the chain is on your door, I understand [Chorus] But this is me swallowing my pride Standing in front of you, saying I'm sorry for that night And I'd go back to December It turns out freedom ain't nothing but missing you Wishing I'd realized what I had when you were mine [Post-Chorus] I'd go back to December, turn around and make it alright I'd go back to December, turn around and change my own mind I go back to December all the time [Outro] All the time "
Speak Now (Deluxe),Mean,"[Verse 1] You, with your words like knives And swords and weapons that you use against me You have knocked me off my feet again Got me feeling like I'm nothing You, with your voice like nails on a chalkboard Calling me out when I'm wounded You, picking on the weaker man [Pre-Chorus] Well, you can take me down With just one single blow But you don't know what you don't know [Chorus] Someday, I'll be living in a big old city And all you're ever gonna be is mean Someday, I'll be big enough so you can't hit me And all you're ever gonna be is mean Why you gotta be so mean? [Verse 2] You, with your switching sides And your wildfire lies and your humiliation You have pointed out my flaws again As if I don't already see them I walk with my head down, trying to block you out 'Cause I'll never impress you I just wanna feel okay again [Pre-Chorus] I bet you got pushed around Somebody made you cold But the cycle ends right now 'Cause you can't lead me down that road And you don't know what you don't know [Chorus] Someday, I'll be living in a big old city And all you're ever gonna be is mean Someday, I'll be big enough so you can't hit me And all you're ever gonna be is mean Why you gotta be so mean? [Bridge] And I can see you years from now in a bar Talking over a football game With that same big loud opinion But nobody's listening Washed up and ranting about the same old bitter things Drunk and grumbling on about how I can't sing But all you are is mean All you are is mean And a liar, and pathetic, and alone in life And mean, and mean, and mean, and mean [Breakdown] But someday, I'll be living in a big old city And all you're ever gonna be is mean, yeah [Chorus] Someday, I'll be big enough so you can't hit me And all you're ever gonna be is mean Why you gotta be so mean? Someday, I'll be living in a big old city (Why you gotta be so mean?) And all you're ever gonna be is mean (Why you gotta be so mean?) Someday, I'll be big enough so you can't hit me (Why you gotta be so mean?) And all you're ever gonna be is mean Why you gotta be so mean? "
Speak Now (Deluxe),Mine,"[Verse 1] You were in college, working part-time, waiting tables Left a small town and never looked back I was a flight risk, with a fear of falling Wondering why we bother with love, if it never lasts [Pre-Chorus 1] I say, ""Can you believe it?"" As we're lying on the couch The moment, I could see it Yes, yes, I can see it now [Chorus] Do you remember, we were sitting there, by the water? You put your arm around me for the first time You made a rebel of a careless man's careful daughter You are the best thing that's ever been mine [Verse 2] Flash forward, and we're taking on the world together And there's a drawer of my things at your place You learn my secrets and figure out why I'm guarded You say we'll never make my parents' mistakes [Pre-Chorus 2] But we got bills to pay We got nothing figured out When it was hard to take Yes, yes This is what I thought about: [Chorus] Do you remember, we were sitting there, by the water? You put your arm around me for the first time You made a rebel of a careless man's careful daughter You are the best thing that's ever been mine Do you remember all the city lights on the water? You saw me start to believe for the first time You made a rebel of a careless man's careful daughter You are the best thing that's ever been mine [Bridge] And I remember that fight, 2:30 AM As everything was slipping right out of our hands I ran out, crying, and you followed me out into the street Braced myself for the goodbye 'Cause that's all I've ever known Then, you took me by surprise You said, ""I'll never leave you alone."" [Chorus 2] You said, ""I remember how we felt, sitting by the water And every time I look at you, it's like the first time I fell in love with a careless man's careful daughter She is the best thing that's ever been mine"" Hold on, make it last Hold on, never turn back You made a rebel of a careless man's careful daughter You are the best thing that's ever been mine [Outro] Yeah, yeah Do you believe it? (Hold on) We're gonna make it now (Hold on) And I can see it Yeah, yeah I can see it now (See it now) "
Speak Now (Deluxe),Speak Now,"[Intro] I am not the kind of girl Who should be rudely barging in On a white veil occasion But you are not the kind of boy Who should be marrying the wrong girl [Verse 1] I sneak in and see your friends And her snotty little family All dressed in pastel And she is yelling at a bridesmaid Somewhere back inside a room Wearing a gown shaped like a pastry [Pre-Chorus] This is surely not What you thought it would be I lose myself in a daydream Where I stand and say [Chorus] Don't say yes, run away now I'll meet you when you're out Of the church at the back door Don't wait or say a single vow You need to hear me out And they said ""speak now"" [Verse 2] Fond gestures are exchanged And the organ starts to play A song that sounds like a death march And I am hiding in the curtains It seems that I was uninvited By your lovely bride-to-be [Pre-Chorus] She floats down the aisle Like a pageant queen But I know you wish it was me You wish it was me (Don't you) [Chorus] Don't say yes, run away now I'll meet you when you're out Of the church at the back door Don't wait or say a single vow You need to hear me out And they said ""speak now"" [Chorus] Don't say yes, run away now I'll meet you when you're out Of the church at the back door Don't wait or say a single vow Your time is running out And they said ""speak now"" [Interlude] Ooh, la-da-da-da, oh Ooh, ooh (Say a single vow) [Bridge] I hear the preacher say Speak now or forever hold your peace There's the silence, there's my last chance I stand up with shaking hands, all eyes on me Horrified looks from everyone in the room But I'm only looking at you [Verse 3] I am not the kind of girl Who should be rudely barging in On a white veil occasion But you are not the kind of boy Who should be marrying the wrong girl (Hehe!) [Chorus] So don't say yes, run away now I'll meet you when you're out Of the church at the back door Don't wait or say a single vow You need to hear me out And they said ""speak now"" [Chorus - Variation] And you say Let's run away now I'm out of my tux at the back door Baby, I didn't say my vows So glad you were around when they said Speak now "
