album,song_title,lyrics
Speak Now (Deluxe),The Story of Us,"[Verse 1] I used to think one day, we'd tell the story of us How we met, and the sparks flew instantly And people would say, they're the lucky ones I used to know my place was a spot next to you Now I'm searching the room for an empty seat 'Cause lately, I don't even know what page you're on [Pre-Chorus 1] Oh, a simple complication Miscommunications lead to fallout So many things that I wish you knew So many walls up, I can't break through [Chorus] Now I'm standing alone in a crowded room And we're not speaking And I'm dying to know Is it killing you like it's killing me? Yeah, I don't know what to say Since the twist of fate when it all broke down And the story of us looks a lot like a tragedy now Next chapter [Verse 2] How'd we end up this way? See me nervously pulling at my clothes and trying to look busy And you're doing your best to avoid me I'm starting to think one day, I'll tell the story of us Of how I was losing my mind when I saw you here But you held your pride like you should've held me [Pre-Chorus 2] Oh, I'm scared to see the ending Why are we pretending this is nothing? I'd tell you I miss you, but I don't know how I've never heard silence quite this loud [Chorus] Now I'm standing alone in a crowded room And we're not speaking And I'm dying to know Is it killing you like it's killing me? Yeah, and I don't know what to say Since the twist of fate, when it all broke down And the story of us looks a lot like a tragedy now [Bridge] This is looking like a contest Of who can act like they care less But I liked it better when you were on my side The battle's in your hands now But I would lay my armor down If you say you'd rather love than fight So many things that you wish I knew But the story of us might be ending soon [Chorus] Now I'm standing alone in a crowded room And we're not speaking And I'm dying to know Is it killing you like it's killing me? Yeah, and I don't know what to say Since the twist of fate, when it all broke down And the story of us looks a lot like a tragedy now, now, now [Outro] And we're not speaking And I'm dying to know Is it killing you like it's killing me, yeah? I don't know what to say since the twist of fate 'Cause we're going down And the story of us looks a lot like a tragedy now The End "
Taylor Swift,Tim McGraw,"[Verse 1] He said the way my blue eyes shined Put those Georgia stars to shame that night I said, ""That's a lie"" Just a boy in a Chevy truck That had a tendency of gettin' stuck On backroads at night And I was right there beside him all summer long And then the time we woke up to find that summer gone [Chorus] But when you think Tim McGraw I hope you think my favorite song The one we danced to all night long The moon like a spotlight on the lake When you think happiness I hope you think that little black dress Think of my head on your chest And my old faded blue jeans When you think Tim McGraw I hope you think of me [Verse 2] September saw a month of tears And thankin' God that you weren't here To see me like that But in a box beneath my bed Is a letter that you never read From three summers back It's hard not to find it all a little bittersweet And lookin' back on all of that, it's nice to believe [Chorus] When you think Tim McGraw I hope you think my favorite song The one we danced to all night long The moon like a spotlight on the lake When you think happiness I hope you think that little black dress Think of my head on your chest And my old faded blue jeans When you think Tim McGraw I hope you think of me [Bridge] And I'm back for the first time since then I'm standin' on your street And there's a letter left on your doorstep And the first thing that you'll read is: When you think
I hope it takes you back to that place [Chorus] When you think happiness I hope you think that little black dress Think of my head on your chest And my old faded blue jeans When you think Tim McGraw I hope you think of me Oh, think of me Mmmm [Outro] He said the way my blue eyes shine Put those Georgia stars to shame that night I said, ""That's a lie"" "
Taylor Swift,Should've Said No,"[Verse 1] It's strange to think the songs we used to sing The smiles, the flowers, everything is gone Yesterday I found out about you Even now just looking at you: feels wrong [Pre-Chorus] You say that you'd take it all back, given one chance It was a moment of weakness and you said, ""Yes"" [Chorus] You should've said, ""No"" You should've gone home You should've thought twice 'fore you let it all go You should've known that word, 'bout what you did with her’d Get back to me (Get back to me) And I should've been there, in the back of your mind I shouldn't be asking myself, ""Why?"" You shouldn't be begging for forgiveness at my feet You should've said no, baby, and you might still have me [Verse 2] You can see that I've been crying Baby, you know all the right things to say But do you honestly expect me to believe We could ever be the same? [Pre-Chorus] You say that the past is the past, you need one chance It was a moment of weakness and you said, ""Yes"" [Chorus] You should've said, ""No"" You should've gone home You should've thought twice 'fore you let it all go You should've known that word, 'bout what you did with her’d Get back to me (Get back to me) And I should've been there, in the back of your mind I shouldn't be asking myself, ""Why?"" You shouldn't be begging for forgiveness at my feet You should've said no, baby, and you might still have me [Bridge] I can't resist Before you go tell me this Was it worth it? Was she worth this? No no, no, no [Chorus] You should've said, ""No"" You should've gone home You should've thought twice 'fore you let it all go You should've known that word, 'bout what you did with her’d Get back to me (Get back to me) And I should've been there, in the back of your mind I shouldn't be asking myself, ""Why?"" You shouldn't be begging for forgiveness at my feet You should've said no, baby, and you might still have me "
Taylor Swift,Teardrops on My Guitar (Pop Version),"[Verse 1] Drew looks at me I fake a smile so he won't see What I want and I need And everything that we should be [Pre-Chorus 1] I'll bet she's beautiful That girl he talks about And she's got everything That I have to live without [Verse 2] Drew talks to me I laugh 'cause it's just so funny But I can't even see Anyone when he's with me [Pre-Chorus 2] He says he's so in love He's finally got it right I wonder if he knows He's all I think about at night [Chorus] He's the reason for the teardrops on my guitar The only thing that keeps me wishing on a wishing star He's the song in the car I keep singing Don't know why I do [Verse 3] Drew walks by me Can he tell that I can't breathe? And there he goes, so perfectly The kind of flawless I wish I could be [Pre-Chorus 3] She better hold him tight Give him all her love Look in those beautiful eyes And know she's lucky 'cause [Chorus] He's the reason for the teardrops on my guitar The only thing that keeps me wishing on a wishing star He's the song in the car I keep singing Don't know why I do [Bridge] So I drive home alone As I turn out the light I'll put his picture down And maybe get some sleep tonight [Chorus] 'Cause he's the reason for the teardrops on my guitar The only one who's got enough of me to break my heart He's the song in the car I keep singing Don't know why I do [Outro] He's the time taken up, but there's never enough And he's all that I need to fall into Drew looks at me I fake a smile so he won't see "
Taylor Swift,Our Song,"[Verse 1] I was riding shotgun with my hair undone In the front seat of his car He's got a one-hand feel on the steering wheel The other on my heart I look around, turn the radio down He says, ""Baby, is something wrong?"" I say, ""Nothing, I was just thinking How we don't have a song"" And he says [Chorus] Our song is the slamming screen door Sneakin' out late, tapping on your window When we're on the phone and you talk real slow 'Cause it's late and your mama don't know Our song is the way you laugh The first date: ""Man, I didn't kiss her, and I should have"" And when I got home 'fore I said amen Asking God if he could play it again [Verse 2] I was walking up the front porch steps After everything that day Had gone all wrong and been trampled on And lost and thrown away Got to the hallway, well on my way To my lovin' bed I almost didn't notice all the roses And the note that said [Chorus] Our song is the slamming screen door Sneakin' out late, tapping on your window When we're on the phone and you talk real slow 'Cause it's late and your mama don't know Our song is the way you laugh The first date: ""Man, I didn't kiss her, and I should have"" And when I got home 'fore I said amen Asking God if he could play it again [Bridge] I've heard every album, listened to the radio Waited for something to come along That was as good as our song [Chorus] 'Cause our song is the slamming screen door Sneakin' out late, tapping on his window When we're on the phone and he talks real slow 'Cause it's late and his mama don't know Our song is the way he laughs The first date: ""Man, I didn't kiss him, and I should have"" And when I got home 'fore I said amen Asking God if he could play it again Play it again [Outro] I was riding shotgun with my hair undone In the front seat of his car I grabbed a pen and an old napkin And I wrote down our song "